<?xml version="1.0" encoding="UTF-8"?>
<!--Sample XML file generated by XMLSPY v5 rel. 4 U (http://www.xmlspy.com)-->
<soajConfiguration xmlns="http://javector.com/soaj/config" xmlns:xsi="http://www.w3.org/2001/XMLSchema-instance" xsi:schemaLocation="http://javector.com/soaj/config
D:/vinit_home/soaj_root_may_20/provider/jar/src/main/resources/config/soaj-config.xsd"
xmlns:test="http://javector.com/ser/adaptive/po"
 xmlns:po="http://javector.com/ser/adaptive/po">
    <soajWSDL wsdlName="TestWsdl" wsdlNamespace="http://www.javector.com">
		<soajService serviceName="SoajTestService">
			<soajPort portName="testPort" endpoint="http://localhost:8080/provider-dummy/test">
				<soajOperation operationName="OperationName">
					<soajPOJOMethod  javaMethod="invokeService" javaClass="com.javector.adaptive.dummy.DummyHandler">
						<paramClass>com.javector.ser.adaptive.po.Address</paramClass>
					</soajPOJOMethod>
					<parameterMapping>
						<javaClass>com.javector.ser.adaptive.po.Address</javaClass>
						<xmlElement>
								<eltName>test:billToType</eltName>
								<eltType>test:billToType</eltType>
						</xmlElement>
					</parameterMapping>
					<returnMapping>
						<javaClass>com.javector.ser.adaptive.po.Address</javaClass>
						<xmlElement>
							<eltName>test:billToType</eltName>
							<eltType>test:billToType</eltType>
						</xmlElement>
					</returnMapping>
					<exceptionMapping>
						<javaClass>String</javaClass>
						<xmlElement>
							<eltRef>q:name</eltRef>
						</xmlElement>
					</exceptionMapping>
				</soajOperation>

                 <soajOperation operationName="getBillToFromEJB30">
          <soajEJB30Method javaMethod="getBillToFromEJB30"
            javaClass="samples.EJB30Tester">
            <paramClass>com.javector.ser.adaptive.po.MyPurchaseOrder</paramClass>
          </soajEJB30Method>
          <parameterMapping>
            <javaClass>com.javector.ser.adaptive.po.MyPurchaseOrder</javaClass>
            <xmlElement>
              <eltRef>po:PurchaseOrder</eltRef>
            </xmlElement>
          </parameterMapping>
          <returnMapping>
            <javaClass>com.javector.ser.adaptive.po.Address</javaClass>
            <xmlElement>
              <eltName>po:billTo</eltName>
              <eltType>po:billToType</eltType>
            </xmlElement>
          </returnMapping>
        </soajOperation>

            </soajPort>
		</soajService>
	</soajWSDL>
    <mappingXml>config/SoajProviderMapping.xml</mappingXml>
    <userDefinedSchemas>
            <userDefinedSchema>
                <targetNamespace>http://javector.com/ser/adaptive/po</targetNamespace>
                <schemaLocation>com/javector/ser/adaptive/po/TestAdaptiveSerializerPO.xsd</schemaLocation>
            </userDefinedSchema>
    </userDefinedSchemas>

    <classpath classpathId="String">
		<jar>http://www.altova.com</jar>
	</classpath>
</soajConfiguration>
