<?xml version="1.0" encoding="UTF-8"?>
<!--Sample XML file generated by XMLSPY v5 rel. 4 U (http://www.xmlspy.com)-->
<soajConfiguration xmlns="http://javector.com/soaj/config" xmlns:xsi="http://www.w3.org/2001/XMLSchema-instance"
                   xsi:schemaLocation="config/soaj-config.xsd"
xmlns:test="http://javector.com/ser/adaptive/po"
 xmlns:po="http://javector.com/ser/adaptive/po">
    <soajWSDL wsdlName="TestWsdl" wsdlNamespace="http://www.javector.com">
		<soajService serviceName="SoajTestService">
			<soajPort portName="testPort" endpoint="http://localhost:8080/provider-dummy/test">
				<soajOperation operationName="OperationName">
					<soajPOJOMethod  javaMethod="getItem" javaClass="com.sun.j2ee.blueprints.catalog.client.CatalogHelper">
						<paramClass>java.lang.String</paramClass>
                        <paramClass>java.util.Locle</paramClass>
                    </soajPOJOMethod>
					<parameterMapping>
						<javaClass>java.lang.String</javaClass>
						<xmlElement>
								<eltName>xs:string</eltName>
								<eltType>xs:string</eltType>
						</xmlElement>
					</parameterMapping>
                    <parameterMapping>
						<javaClass>java.util.Locle</javaClass>
						<xmlElement>
								<eltName>xs:string</eltName>
								<eltType>xs:string</eltType>
						</xmlElement>
					</parameterMapping>
                    <returnMapping>
						<javaClass>com.sun.j2ee.blueprints.catalog.model.Item</javaClass>
						<xmlElement>
							<eltName>tns:ItemLookUpResponse</eltName>
							<eltType>tns:ItemLookUpResponse</eltType>
						</xmlElement>
					</returnMapping>
					<exceptionMapping>
						<javaClass>String</javaClass>
						<xmlElement>
							<eltRef>q:name</eltRef>
						</xmlElement>
					</exceptionMapping>
				</soajOperation>
            </soajPort>
		</soajService>
	</soajWSDL>
    <mappingXml>config/PetStoreSoajConfig.xml</mappingXml>
    <userDefinedSchemas>
            <userDefinedSchema>
                <targetNamespace>http://webservices.amazon.com/AWSECommerceService</targetNamespace>
                <schemaLocation>com/amazon/webservices/AWSECommerceService/petStoreTypes.xsd</schemaLocation>
            </userDefinedSchema>
    </userDefinedSchemas>

    <classpath classpathId="String">
		<jar>http://www.altova.com</jar>
	</classpath>
</soajConfiguration>
