<?xml version="1.0" encoding="UTF-8"?>
<soajConfiguration xmlns:xsi="http://www.w3.org/2001/XMLSchema-instance"
  xsi:schemaLocation="http://javector.com/soaj/config ../../../../../../../provider/src/main/resources/config/soaj-config.xsd"
  xmlns:po="http://javector.com/ser/adaptive/po"
  xmlns:xs="http://www.w3.org/2001/XMLSchema"
  xmlns="http://javector.com/soaj/config">
  <soajWSDL wsdlName="VoidReturnTypeConfig"
    wsdlNamespace="http://javector.com/soaj/test/wsdlgen/voidReturnType">
    <soajService serviceName="UpdateAddressService">
      <soajPort portName="UpdateAddressPort"
        endpoint="http://localhost:8080/soaj/wsdlgenTest/voidReturnType">
        <soajOperation operationName="updateAddress">
          <soajPOJOMethod javaMethod="updateAddress"
            javaClass="com.javector.soaj.wsdlgentest.po.PurchaseOrderProcessing">
            <paramClass>java.lang.String</paramClass>
            <paramClass>com.javector.soaj.wsdlgentest.po.Address</paramClass>
          </soajPOJOMethod>
          <parameterMapping>
            <javaClass>java.lang.String</javaClass>
            <xmlElement>
              <eltName>poNum</eltName>
              <eltType>xs:string</eltType>
            </xmlElement>
          </parameterMapping>
          <parameterMapping>
            <javaClass>com.javector.soaj.wsdlgentest.po.Address</javaClass>
            <xmlElement>
              <eltName>addr</eltName>
              <eltType>po:BillToType</eltType>
            </xmlElement>
          </parameterMapping>
          <returnMapping>
            <javaClass>void</javaClass>
                  <xmlElement>
	                  <eltName>void</eltName>
	                  <eltType>xs:void</eltType>
	                </xmlElement>
          </returnMapping>
        </soajOperation>
      </soajPort>
    </soajService>
  </soajWSDL>
  <mappingXml>config/soajmapping.xml</mappingXml>
  <userDefinedSchemas>
    <userDefinedSchema>
      <targetNamespace>http://javector.com/ser/adaptive/po</targetNamespace>
      <schemaLocation>purchaseOrder.xsd</schemaLocation>
    </userDefinedSchema>
  </userDefinedSchemas>
</soajConfiguration>
